{
  "schemaVersion": "1.0.0",
  "runId": "tfrt-near-optimized-fixture-001",
  "runType": "inference",
  "framework": "tensorflowrt",
  "createdUtc": "2026-02-09T00:01:10Z",
  "label": "Near-Optimized",
  "metadata": {
    "modelFingerprint": "3333333333333333333333333333333333333333333333333333333333333333",
    "datasetFingerprint": "aaaaaaaaaaaaaaaaaaaaaaaaaaaaaaaaaaaaaaaaaaaaaaaaaaaaaaaaaaaaaaaa",
    "codeFingerprint": "bbbbbbbbbbbbbbbbbbbbbbbbbbbbbbbbbbbbbbbbbbbbbbbbbbbbbbbbbbbbbbbb",
    "environmentFingerprint": "cccccccccccccccccccccccccccccccccccccccccccccccccccccccccccccccc",
    "seed": 12345,
    "tags": ["fixture", "tfrt", "nearly_identical"],
    "notes": "Nearly identical fixture B - tiny steady-state difference, tests suppression.",
    "frameworkDetails": {
      "device": "GPU:Mock",
      "batchSize": 1,
      "inputShape": "[1,224,224,3]",
      "tfrtVersion": "mock-1.0"
    }
  },
  "timeline": {
    "steps": [0, 1, 2, 3, 4, 5, 6, 7, 8, 9, 10, 11, 12, 13, 14, 15, 16, 17, 18, 19],
    "wallTimeSeconds": [0, 1, 2, 3, 4, 5, 6, 7, 8, 9, 10, 11, 12, 13, 14, 15, 16, 17, 18, 19]
  },
  "scalars": {
    "series": [
      {
        "name": "latency_ms",
        "unit": "milliseconds",
        "sourceKey": "tfrt/latency_ms",
        "aggregation": "none",
        "description": "End-to-end inference latency per iteration.",
        "values": [40, 34, 30, 27, 25, 24, 24, 24, 24, 24, 24, 24, 24, 24, 24, 24, 24, 24, 24, 24]
      }
    ]
  },
  "milestones": {
    "list": [
      { "type": "warmup_end", "step": 5, "label": "Warmup ends" },
      { "type": "steady_state_start", "step": 6, "label": "Steady state begins" },
      { "type": "steady_state_end", "step": 19, "label": "Steady state ends" }
    ]
  },
  "artifacts": [],
  "capabilities": {
    "hasLoss": false,
    "hasAccuracy": false,
    "hasLatency": true,
    "hasThroughput": false,
    "hasMemory": false,
    "hasCheckpoints": false,
    "hasProfiler": false,
    "hasEvaluatorVectors": false,
    "hasEigenSpectrum": false
  },
  "provenance": {
    "source": "TensorFlowRTOfflineConnector",
    "sourceVersion": "mock-1.0",
    "ingestedUtc": "2026-02-09T00:01:10Z",
    "connectorId": "tensorflowrt-offline",
    "connectorVersion": "1.0.0"
  }
}
